{
  "$schema": "https://json-schema.org/draft/2020-12/schema",
  "$id": "https://black-onyx.local/schemas/malware_report.json",
  "title": "MalwareReport",
  "description": "Normalized static/dynamic malware analysis report for findings.malware.",
  "type": "object",
  "required": ["finding_type", "sample", "scores"],
  "properties": {
    "finding_type": { "const": "malware_analysis" },
    "sample": {
      "type": "object",
      "required": ["sha256"],
      "properties": {
        "sha256": { "type": "string", "minLength": 64, "maxLength": 64 },
        "sha1": { "type": ["string", "null"] },
        "md5": { "type": ["string", "null"] },
        "file_type": { "type": ["string", "null"] },
        "names": {
          "type": "array",
          "items": { "type": "string" }
        },
        "size_bytes": { "type": ["integer", "null"] },
        "ssdeep": { "type": ["string", "null"] },
        "tlsh": { "type": ["string", "null"] }
      },
      "additionalProperties": true
    },
    "scores": {
      "type": "object",
      "properties": {
        "static_ember": { "type": ["number", "null"], "minimum": 0, "maximum": 1 },
        "sandbox_score": { "type": ["number", "null"] },
        "clamav": { "type": ["string", "null"] }
      },
      "additionalProperties": true
    },
    "yara": {
      "type": "array",
      "items": {
        "type": "object",
        "properties": {
          "rule": { "type": "string" },
          "namespace": { "type": ["string", "null"] },
          "tags": {
            "type": "array",
            "items": { "type": "string" }
          }
        },
        "additionalProperties": true
      }
    },
    "capabilities": {
      "type": "array",
      "items": {
        "type": "object",
        "properties": {
          "name": { "type": "string" },
          "att&ck": {
            "type": "array",
            "items": { "type": "string" }
          }
        },
        "additionalProperties": true
      }
    },
    "family": { "type": ["string", "null"] },
    "config": { "type": "object" },
    "process_tree": { "type": "array", "items": { "type": "object" } },
    "files_dropped": { "type": "array", "items": { "type": "object" } },
    "network": {
      "type": "object",
      "properties": {
        "dns": { "type": "array", "items": { "type": "string" } },
        "hosts": { "type": "array", "items": { "type": "string" } },
        "pcap_uri": { "type": ["string", "null"] }
      },
      "additionalProperties": true
    },
    "screenshots": {
      "type": "array",
      "items": { "type": "string" }
    },
    "mitre_techniques": {
      "type": "array",
      "items": { "type": "string" }
    },
    "timeline": { "type": "array", "items": { "type": "object" } },
    "sandbox": {
      "type": "object",
      "properties": {
        "product": { "type": ["string", "null"] },
        "machine": { "type": ["string", "null"] },
        "duration_s": { "type": ["number", "null"] },
        "task_id": { "type": ["string", "integer", "null"] }
      },
      "additionalProperties": true
    },
    "stage": {
      "type": "string",
      "enum": ["static", "dynamic", "emulation"]
    }
  },
  "additionalProperties": true
}
