{
  "finding_type": "malware_analysis",
  "sample": {
    "sha256": "aaaaaaaaaaaaaaaaaaaaaaaaaaaaaaaaaaaaaaaaaaaaaaaaaaaaaaaaaaaaaaaa",
    "file_type": "pe",
    "names": ["sample.bin"],
    "size_bytes": 4096
  },
  "scores": {
    "static_ember": 0.91,
    "sandbox_score": 8.5,
    "clamav": "Win.Trojan.Generic"
  },
  "yara": [{ "rule": "suspicious_packer", "tags": ["packer"] }],
  "capabilities": [{ "name": "inject thread", "att&ck": ["T1055"] }],
  "family": "generic",
  "config": {},
  "process_tree": [
    {
      "pid": 1000,
      "ppid": 800,
      "process_name": "sample.bin",
      "command_line": "sample.bin"
    }
  ],
  "files_dropped": [],
  "network": {
    "dns": ["evil.example"],
    "hosts": ["203.0.113.50"],
    "pcap_uri": "s3://black-onyx-malware/reports/task-1/dump.pcap"
  },
  "screenshots": ["s3://black-onyx-malware/reports/task-1/shot1.png"],
  "mitre_techniques": ["T1055", "T1059.003"],
  "timeline": [],
  "sandbox": {
    "product": "cape",
    "machine": "win10-office",
    "duration_s": 180,
    "task_id": 42
  },
  "stage": "dynamic"
}
